{"authority":"NONE","blockers":[],"changed_files":["docs/sscm-repair-dogfood.txt"],"claimed_candidate_revision":"2a93e1d66b7a3c3edb4dc069e0fe2ff5c3d97f06","role":"IMPLEMENTER","status":"SUCCEEDED","summary":"Applied the exact content repair and committed as 'dogfood: SSCM repair candidate 2'. All required checks passed. No push performed.","tests_run":["Verified candidate descends from base revision.","Verified diff touches only the allowed file.","Verified worktree and committed content are byte-exact SSCM_REPAIR_OK\\n.","Verified clean worktree with no untracked files.","Verified required branch and commit message."]}
