{"authority":"NONE","blockers":[],"changed_files":["docs/sscm-fanout-a.txt"],"claimed_candidate_revision":"7531f8031097dcec47100da161809eede33d763c","role":"IMPLEMENTER","status":"SUCCEEDED","summary":"Created and committed the authorized file with the exact required content. No other paths changed and nothing was pushed.","tests_run":["Verified HEAD parent equals required base revision","Verified commit contains only docs/sscm-fanout-a.txt","Verified exact 17-byte content SSCM_FANOUT_A_OK followed by one newline","Verified required commit message","Verified worktree is clean"]}
