{"authority":"NONE","blockers":[],"changed_files":["docs/sscm-dogfood.txt"],"claimed_candidate_revision":"3de5b82552f39d6c319f5171ed22911b4ca89d75","role":"IMPLEMENTER","status":"SUCCEEDED","summary":"Created and committed the byte-exact SSCM marker on the isolated implementer branch with the required commit message. No push performed.","tests_run":["Verified exact 18-byte content and hexadecimal encoding","Verified mode 100644","Verified exactly one commit descending from base","Verified changed-file set contains only the required file","Verified clean worktree"]}
