{"authority":"NONE","blockers":[],"changed_files":["docs/sscm-fanout-b.txt"],"claimed_candidate_revision":"6a8c1a21f45c8e1a827fe64adc88ee051597c4aa","role":"IMPLEMENTER","status":"SUCCEEDED","summary":"Created the authorized file with exactly SSCM_FANOUT_B_OK followed by one newline and committed it with the required message. No push performed.","tests_run":["Verified HEAD parent equals required base revision","Verified committed file content and exact 17-byte size","Verified commit message","Verified commit changes only docs/sscm-fanout-b.txt","Verified worktree is clean"]}
