{"authority":"NONE","blockers":[],"changed_files":["docs/sscm-repair-dogfood.txt"],"claimed_candidate_revision":"6edb3a2ac4dd1ce7a2595fe47c5ba8d8c7a47f21","role":"IMPLEMENTER","status":"SUCCEEDED","summary":"Created the exact seed file and committed it as \"dogfood: SSCM repair candidate 1\". Working tree is clean; no push performed.","tests_run":["Verified clean working tree and required branch.","Verified exactly one changed file with one insertion and zero deletions.","Verified exact 17-byte content and matching SHA-256.","Verified exactly one new commit and required commit message."]}
